id,title,sort_title,genre,notes,url,author,composer
25,Zémire et Azor,zemire et azor,Opéra comique,A German version of Zémire et Azor had been in the repertory of the court theater since 13 Oct 1779.,NA,"Marmontel, Jean-Françoise","Grétry, André Ernest Modeste"
204,Zu gut ist nicht gut,zu gut ist nicht gut,Lustspiel,"""nationalisieret von Herrn Schmidt."" First performed by the Nationaltheater on 22 Nov 1777.",https://books.google.com/books?id=F_5HAAAAcAAJ&pg=PA1#v=onepage&q&f=false,"Goldsmith, Oliver",NA
NA,NA,NA,NA,NA,NA,"Schmidt, Johann Friedrich",NA
194,Die zwey Gräfinnen,zwey graefinnen,Singspiel,Adapted from Le due contesse.,https://books.google.com/books?id=6gFXAAAAcAAJ&pg=PA3#v=onepage&q&f=false,"Petrosellini, Giuseppe","Paisiello, Giovanni"
NA,NA,NA,NA,NA,NA,unknown,NA
